{
  "schemaVersion": 1,
  "generatedAt": "2026-09-26T10:08:08+00:00",
  "repository": {
    "url": "https://github.com/IntelliMarkets/Jianer_Plugin_Market_Next",
    "ref": "4b6d72d5b78811788c95001fe3be5d8be1dd5daf",
    "releaseUrlTemplate": "https://github.com/IntelliMarkets/Jianer_Plugin_Market_Next/releases/download/{tag}/{asset}"
  },
  "plugins": []
}
